artist,year,album,track_n,track_title,line,lyric
Taylor Swift,2010/10/25,Speak Now,17,Superman,9,"I say ,""Just fine"""
Taylor Swift,2010/10/25,Speak Now,17,Superman,10,"I always forget to tell you,I love you,I love you forever"
Taylor Swift,2010/10/25,Speak Now,17,Superman,11,I watch superman fly away
Taylor Swift,2010/10/25,Speak Now,17,Superman,12,You've got a busy day today
Taylor Swift,2010/10/25,Speak Now,17,Superman,13,"Go save the world,I'll be around"
Taylor Swift,2010/10/25,Speak Now,17,Superman,14,I watch superman fly away
Taylor Swift,2010/10/25,Speak Now,17,Superman,15,Come back I'll be with you someday
Taylor Swift,2010/10/25,Speak Now,17,Superman,16,I'll be right here on the ground
Taylor Swift,2010/10/25,Speak Now,17,Superman,17,When you come back down
Taylor Swift,2010/10/25,Speak Now,17,Superman,18,"Tall,dark and beautiful"
Taylor Swift,2010/10/25,Speak Now,17,Superman,19,"He's complicated,he's irrational"
Taylor Swift,2010/10/25,Speak Now,17,Superman,20,"But I hope someday you'll take me away and save the day,yeah"
Taylor Swift,2010/10/25,Speak Now,17,Superman,21,Something in his deep brown eyes has me sayin'
Taylor Swift,2010/10/25,Speak Now,17,Superman,22,He's not all bad like his reputation
Taylor Swift,2010/10/25,Speak Now,17,Superman,23,And I can't hear one single word they say
Taylor Swift,2010/10/25,Speak Now,17,Superman,24,"And you'll leave,got places to be and I'll be OK"
Taylor Swift,2010/10/25,Speak Now,17,Superman,25,"I always forget to tell you I love you,I loved you from the very first day"
Taylor Swift,2010/10/25,Speak Now,17,Superman,26,I watch superman fly away
Taylor Swift,2010/10/25,Speak Now,17,Superman,27,You've got a busy day today
Taylor Swift,2010/10/25,Speak Now,17,Superman,28,"Go save the world,I'll be around"
Taylor Swift,2010/10/25,Speak Now,17,Superman,29,I watch superman fly away
Taylor Swift,2010/10/25,Speak Now,17,Superman,30,Come back I'll be with you someday
Taylor Swift,2010/10/25,Speak Now,17,Superman,31,I'll be right here on the ground
Taylor Swift,2010/10/25,Speak Now,17,Superman,32,When you come back down
Taylor Swift,2010/10/25,Speak Now,17,Superman,33,And I watch you fly around the world
Taylor Swift,2010/10/25,Speak Now,17,Superman,34,And I hope you don't save some other girl
Taylor Swift,2010/10/25,Speak Now,17,Superman,35,"Don't forget,don't forget about me"
Taylor Swift,2010/10/25,Speak Now,17,Superman,36,I'm far away but I never let you go
Taylor Swift,2010/10/25,Speak Now,17,Superman,37,I'm love-struck and looking out the window
Taylor Swift,2010/10/25,Speak Now,17,Superman,38,"Don't forget,don't forget where I'll be"
Taylor Swift,2010/10/25,Speak Now,17,Superman,39,Right here wishing the flowers were from you
Taylor Swift,2010/10/25,Speak Now,17,Superman,40,Wishing the card was from you
Taylor Swift,2010/10/25,Speak Now,17,Superman,41,Wishing the call was from you
Taylor Swift,2010/10/25,Speak Now,17,Superman,42,Cause I loved you from the very first day
Taylor Swift,2010/10/25,Speak Now,17,Superman,43,I watch superman fly away
Taylor Swift,2010/10/25,Speak Now,17,Superman,44,You've got a busy day today
Taylor Swift,2010/10/25,Speak Now,17,Superman,45,"Go save the world,I'll be around"
Taylor Swift,2010/10/25,Speak Now,17,Superman,46,Forever and ever here
Taylor Swift,2010/10/25,Speak Now,17,Superman,47,I watch superman fly away
Taylor Swift,2010/10/25,Speak Now,17,Superman,48,I swear I'll be with you someday
Taylor Swift,2010/10/25,Speak Now,17,Superman,49,I'll be right here on the ground
Taylor Swift,2010/10/25,Speak Now,17,Superman,50,When you come back down
Taylor Swift,2010/10/25,Speak Now,17,Superman,51,"La,la,la,la,la,la"
Taylor Swift,2010/10/25,Speak Now,17,Superman,52,"La,la,la,la,la,la"
Taylor Swift,2010/10/25,Speak Now,17,Superman,53,When you come back down
